{
  "schema_version": 1,
  "fixture_id": "cut-origin-arc-capsule",
  "story_ids": [
    "E3D-S5-02"
  ],
  "description": "A closed line-and-circular-arc capsule profile removes an exact qualified prismatic/cylindrical pocket while retaining the explicit target body.",
  "units": {
    "length": "nanometer",
    "angle": "radian"
  },
  "input": {
    "schema_version": 5,
    "kind": "single_target_cut",
    "payload": {
      "result_mode": "cut",
      "target_body_ids": [
        "body:part"
      ],
      "target_component_id": "component:root",
      "target_seed": {
        "body_id": "body:part",
        "component_id": "component:root",
        "width_nm": 10000000,
        "height_nm": 6000000,
        "distance_nm": 4000000
      },
      "support": {
        "kind": "origin_plane",
        "plane": "xy"
      },
      "profile": {
        "kind": "line_arc_loop",
        "segments": [
          {
            "kind": "line",
            "start_nm": [
              3000000,
              2000000
            ],
            "end_nm": [
              7000000,
              2000000
            ]
          },
          {
            "kind": "arc",
            "center_nm": [
              7000000,
              3000000
            ],
            "radius_nm": 1000000,
            "start_radians": -1.5707963267948966,
            "sweep_radians": 3.141592653589793
          },
          {
            "kind": "line",
            "start_nm": [
              7000000,
              4000000
            ],
            "end_nm": [
              3000000,
              4000000
            ]
          },
          {
            "kind": "arc",
            "center_nm": [
              3000000,
              3000000
            ],
            "radius_nm": 1000000,
            "start_radians": 1.5707963267948966,
            "sweep_radians": 3.141592653589793
          }
        ]
      },
      "distance_nm": 2000000,
      "direction": "positive"
    }
  },
  "expected": {
    "kind": "success",
    "result": {
      "retained_target_body_id": "body:part",
      "affected_body_ids": [
        "body:part"
      ],
      "created_body_count": 0,
      "body_count": 1,
      "manifold": true,
      "orientation": "outward",
      "aabb_nm": [
        0,
        0,
        0,
        10000000,
        6000000,
        4000000
      ],
      "signed_volume_nm3": 217716814692820420000,
      "surface_area_nm2": 276566370614359.2,
      "centroid_nm": [
        5000000,
        3000000,
        2102349.399786228
      ],
      "analytic_classification": [
        "cylinder",
        "plane"
      ],
      "arc_segments_consumed": 2
    }
  },
  "tolerances": {
    "relative": 1e-9,
    "aabb_nm": 1,
    "signed_volume_nm3": 1000000,
    "surface_area_nm2": 1000,
    "centroid_nm": 1
  },
  "identity_sets": {
    "retained": [
      "body:part"
    ],
    "replaced": []
  },
  "lifecycle_steps": [
    "preview",
    "commit"
  ],
  "evidence_test_ids": [
    "single-target-cut-contracts",
    "native-single-target-cut",
    "wasm-single-target-cut",
    "single-target-cut-native-wasm-parity"
  ],
  "legacy_provenance": null
}
