{
  "schema_version": 1,
  "fixture_id": "extrude-origin-annulus",
  "story_ids": [
    "E3D-S1-07"
  ],
  "description": "Annulus classifies its inner loop as a stable hole.",
  "units": {
    "length": "nanometer",
    "angle": "radian"
  },
  "input": {
    "schema_version": 2,
    "kind": "extrude_v2",
    "payload": {
      "holes": [
        "circle-r3mm"
      ],
      "result_mode": "new_body",
      "distance_nm": 5000000,
      "outer": "circle-r8mm",
      "support": "origin.xy"
    }
  },
  "expected": {
    "kind": "success",
    "result": {
      "hole_count": 1,
      "analytic_classification": [
        "plane",
        "nurbs_surface"
      ],
      "body_count": 1
    }
  },
  "tolerances": {
    "relative": 1e-9,
    "aabb_nm": 1,
    "signed_volume_nm3": 1000000,
    "surface_area_nm2": 1000,
    "centroid_nm": 1
  },
  "identity_sets": {
    "retained": [],
    "replaced": []
  },
  "lifecycle_steps": [
    "preview",
    "commit",
    "edit",
    "save",
    "reload",
    "recompute"
  ],
  "legacy_provenance": null,
  "evidence_test_ids": [
    "region-contracts",
    "native-extrude-contracts",
    "wasm-extrude-contracts",
    "native-wasm-parity"
  ]
}
