{
  "schema_version": 1,
  "fixture_id": "construction-plane-missing-offset-parameter",
  "story_ids": ["E3D-S3-01", "E3D-S3-02", "E3D-S3-04"],
  "description": "A valid existing construction plane edit that attempts to bind a missing replacement offset parameter enters structured repair state without mutating the last accepted document or body; repair restores the previously accepted parameter binding.",
  "units": { "length": "nanometer", "angle": "radian" },
  "input": {
    "schema_version": 3,
    "kind": "construction_plane_missing_parameter_v3",
    "payload": {
      "plane": "construction-plane:missing-offset",
      "base_plane": "origin.xy",
      "offset_parameter": "parameter:missing-offset",
      "distance_nm": 4000000,
      "direction": "positive",
      "profile": "rectangle-10x6mm"
    }
  },
  "expected": {
    "kind": "structured_error",
    "error": {
      "category": "reference",
      "code": "missing_construction_plane_offset_parameter",
      "field_path": "construction_plane.offset_parameter",
      "referenced_entity_ids": ["parameter:missing-offset"]
    }
  },
  "tolerances": { "relative": 1e-9, "aabb_nm": 1, "signed_volume_nm3": 1000000, "surface_area_nm2": 1000, "centroid_nm": 1 },
  "identity_sets": { "retained": ["body:accepted-before-construction-plane-error"], "replaced": [] },
  "lifecycle_steps": ["preview", "commit", "save", "reopen", "repair"],
  "evidence_test_ids": ["construction-plane-document-contracts", "native-construction-plane-offset-extrude", "wasm-construction-plane-offset-extrude", "construction-plane-offset-native-wasm-parity"],
  "legacy_provenance": null
}
