{
  "schema_version": 1,
  "fixture_id": "qualification-incomplete-candidate",
  "story_ids": [
    "E3D-S1-13"
  ],
  "description": "Harness self-test proves a missing candidate evidence record fails closed.",
  "units": {
    "length": "nanometer",
    "angle": "radian"
  },
  "input": {
    "schema_version": 2,
    "kind": "qualification_self_test",
    "payload": {
      "status": "passed",
      "omit_fixture": "extrude-origin-blind-rectangle"
    }
  },
  "expected": {
    "kind": "structured_error",
    "error": {
      "category": "qualification",
      "code": "missing_evidence",
      "field_path": "evidence",
      "referenced_entity_ids": [
        "extrude-origin-blind-rectangle"
      ]
    }
  },
  "tolerances": {
    "relative": 1e-9,
    "aabb_nm": 1,
    "signed_volume_nm3": 1000000,
    "surface_area_nm2": 1000,
    "centroid_nm": 1
  },
  "identity_sets": {
    "retained": [],
    "replaced": []
  },
  "lifecycle_steps": [
    "recompute"
  ],
  "legacy_provenance": null,
  "evidence_test_ids": [
    "candidate-evidence-completeness"
  ]
}
