{
  "schema_version": 1,
  "fixture_id": "profile-unsupported-spline",
  "story_ids": [
    "E3D-S1-06"
  ],
  "description": "Unsupported spline is rejected before preview without polygon fallback.",
  "units": {
    "length": "nanometer",
    "angle": "radian"
  },
  "input": {
    "schema_version": 2,
    "kind": "extrude_v2",
    "payload": {
      "distance_nm": 8000000,
      "profile": "unsupported-spline",
      "support": "origin.xy"
    }
  },
  "expected": {
    "kind": "structured_error",
    "error": {
      "category": "capability",
      "code": "unsupported_curve_kind",
      "field_path": "sketch.geometry[curve:spline-1].geometry.kind",
      "referenced_entity_ids": [
        "curve:spline-1"
      ]
    }
  },
  "tolerances": {
    "relative": 1e-9,
    "aabb_nm": 1,
    "signed_volume_nm3": 1000000,
    "surface_area_nm2": 1000,
    "centroid_nm": 1
  },
  "identity_sets": {
    "retained": [],
    "replaced": []
  },
  "lifecycle_steps": [
    "preview"
  ],
  "legacy_provenance": null,
  "evidence_test_ids": [
    "native-profile-transport",
    "wasm-profile-transport",
    "native-wasm-parity"
  ]
}
