{
  "schema_version": 1,
  "units": {
    "length": "nanometer",
    "angle": "radian"
  },
  "tolerances": {
    "relative": 1e-09,
    "aabb_nm": 1,
    "signed_volume_nm3": 1000000,
    "surface_area_nm2": 1000,
    "centroid_nm": 1
  },
  "legacy_provenance": null,
  "fixture_id": "cut-last-valid-recovery",
  "story_ids": [
    "E3D-S5-04"
  ],
  "description": "After an accepted Cut, suppressing its upstream sketch blocks recompute at the first unresolved input while retaining the last valid target result through save/reopen; restoring the sketch repairs and recomputes without identity churn.",
  "input": {
    "schema_version": 5,
    "kind": "single_target_cut",
    "payload": {
      "result_mode": "cut",
      "target_body_ids": [
        "body:part"
      ],
      "target_component_id": "component:root",
      "target_seed": {
        "body_id": "body:part",
        "component_id": "component:root",
        "width_nm": 10000000,
        "height_nm": 6000000,
        "distance_nm": 4000000
      },
      "support": {
        "kind": "origin_plane",
        "plane": "xy"
      },
      "profile": {
        "kind": "rectangle",
        "min_nm": [
          2000000,
          1000000
        ],
        "max_nm": [
          8000000,
          5000000
        ]
      },
      "distance_nm": 2000000,
      "direction": "positive"
    }
  },
  "expected": {
    "kind": "success",
    "result": {
      "retained_target_body_id": "body:part",
      "affected_body_ids": [
        "body:part"
      ],
      "created_body_count": 0,
      "body_count": 1,
      "manifold": true,
      "orientation": "outward",
      "aabb_nm": [
        0,
        0,
        0,
        10000000,
        6000000,
        4000000
      ],
      "signed_volume_nm3": 192000000000000000000,
      "surface_area_nm2": 288000000000000,
      "centroid_nm": [
        5000000,
        3000000,
        2250000
      ],
      "analytic_classification": [
        "plane"
      ],
      "last_valid_result_retained": true,
      "failed_state_roundtrip": true,
      "repair_recomputed": true,
      "feature_id_retained": true,
      "target_body_id_retained": true,
      "first_unresolved_input": "feature:sketch:cut-last-valid-recovery",
      "evaluation_stopped_at_first_unresolved": true,
      "failure_diagnostic_roundtrip": true,
      "repair_evaluated_cut_feature": true,
      "repair_transaction_recorded": true,
      "repair_result_bound": true
    }
  },
  "identity_sets": {
    "retained": [
      "body:part",
      "feature:cut-last-valid-recovery"
    ],
    "replaced": []
  },
  "lifecycle_steps": [
    "preview",
    "commit",
    "suppress",
    "save",
    "reopen",
    "repair",
    "recompute"
  ],
  "evidence_test_ids": [
    "single-target-cut-contracts",
    "native-single-target-cut",
    "wasm-single-target-cut",
    "single-target-cut-native-wasm-parity"
  ]
}
