{
  "schema_version": 1,
  "fixture_id": "cut-save-reopen-edit",
  "story_ids": [
    "E3D-S5-01",
    "E3D-S5-02",
    "E3D-S5-03"
  ],
  "description": "Save, reopen, and edit preserve canonical Cut mode, explicit target, support, profile, extent, and retained target identity.",
  "units": {
    "length": "nanometer",
    "angle": "radian"
  },
  "input": {
    "schema_version": 5,
    "kind": "single_target_cut",
    "payload": {
      "result_mode": "cut",
      "target_body_ids": [
        "body:part"
      ],
      "target_component_id": "component:root",
      "target_seed": {
        "body_id": "body:part",
        "component_id": "component:root",
        "width_nm": 10000000,
        "height_nm": 6000000,
        "distance_nm": 4000000
      },
      "support": {
        "kind": "origin_plane",
        "plane": "xy"
      },
      "profile": {
        "kind": "rectangle",
        "min_nm": [
          2000000,
          1000000
        ],
        "max_nm": [
          8000000,
          5000000
        ]
      },
      "distance_nm": 2000000,
      "direction": "positive",
      "roundtrip_edit_distance_nm": 1500000
    }
  },
  "expected": {
    "kind": "success",
    "result": {
      "retained_target_body_id": "body:part",
      "affected_body_ids": [
        "body:part"
      ],
      "created_body_count": 0,
      "body_count": 1,
      "manifold": true,
      "orientation": "outward",
      "aabb_nm": [
        0,
        0,
        0,
        10000000,
        6000000,
        4000000
      ],
      "signed_volume_nm3": 204000000000000000000,
      "surface_area_nm2": 278000000000000,
      "centroid_nm": [
        5000000,
        3000000,
        2220588.2352941176
      ],
      "analytic_classification": [
        "plane"
      ],
      "canonical_roundtrip": true,
      "target_reference_roundtrip": true,
      "edit_after_reopen_equal": true
    }
  },
  "tolerances": {
    "relative": 1e-9,
    "aabb_nm": 1,
    "signed_volume_nm3": 1000000,
    "surface_area_nm2": 1000,
    "centroid_nm": 1
  },
  "identity_sets": {
    "retained": [
      "body:part"
    ],
    "replaced": []
  },
  "lifecycle_steps": [
    "preview",
    "commit",
    "save",
    "reopen",
    "edit"
  ],
  "evidence_test_ids": [
    "single-target-cut-contracts",
    "native-single-target-cut",
    "wasm-single-target-cut",
    "single-target-cut-native-wasm-parity"
  ],
  "legacy_provenance": null
}
